{
  "id": "official-skn-agents",
  "publisher": "St Kitts and Nevis Citizenship Unit",
  "title": "St Kitts and Nevis authorised agents list",
  "url": "https://ciu.gov.kn/authorised-agents-list/",
  "authorityType": "Official agent register",
  "documentDate": null,
  "rights": {
    "disposition": "link_only",
    "use": "Original CBI normalized facts and pointers only. No upstream documents, images, or excerpts distributed.",
    "basis": "CBI original compilation; upstream rights retained"
  },
  "retrieval": {
    "retrievedAt": null,
    "lastAttempt": "2026-10-25T08:37:07.920Z",
    "method": "not_extracted",
    "health": "unavailable",
    "hash": null
  },
  "manualReview": {
    "intervalDays": 14,
    "rationale": "Evidence interpretation requires editorial review; a successful fetch is not verification."
  },
  "reviewObservation": {
    "date": "2026-10-21",
    "method": "Official register read. Inclusion is not a customer-service rating or guarantee of approval."
  }
}
