{
  "id": "lc-legislation-index",
  "publisher": "Saint Lucia CIP",
  "title": "Current programme legislation index",
  "url": "https://www.cipsaintlucia.com/citizenship-legislation",
  "authorityType": "Government legislation index",
  "documentDate": null,
  "rights": {
    "disposition": "link_only",
    "use": "CBI original factual normalization and source pointers only; no upstream documents or excerpts redistributed",
    "basis": "Original CBI compilation; upstream rights retained"
  },
  "reviewObservation": {
    "date": "2026-10-25",
    "method": "Independent primary-source CBI review; legal document locators and limitations recorded"
  },
  "retrieval": {
    "retrievedAt": "2026-10-25T09:14:10.344Z",
    "lastAttempt": "2026-10-25T09:14:10.344Z",
    "method": "retrieval_hash_only",
    "health": "available",
    "hash": "d47dc75f4bd2c734e42524c744e66350e094cfd7b104ed7a202b8d2d18345ea6"
  },
  "manualReview": {
    "intervalDays": 14,
    "rationale": "Review exact legal/operational scope; retrieval cannot refresh the factual review."
  }
}
