{
  "id": "nr",
  "publisher": "Naoero Program Office",
  "title": "Citizenship programme costs",
  "url": "https://www.ecrcp.gov.nr/contribution",
  "authorityType": "Government guidance",
  "documentDate": null,
  "rights": {
    "disposition": "link_only",
    "use": "CBI original factual normalization and references only; no upstream pages, PDFs, images or excerpts redistributed",
    "basis": "Original compilation; no upstream republication licence asserted"
  },
  "retrieval": {
    "retrievedAt": "2026-10-25T08:26:36.066Z",
    "lastAttempt": "2026-10-25T08:26:36.066Z",
    "method": "retrieval_hash_only",
    "health": "available",
    "hash": "5e0a76477a00ba9780dca07b953cc5408b563d581de28cedfb062ac5dc3609ec"
  },
  "manualReview": {
    "intervalDays": 14,
    "rationale": "Review exact claim and source applicability; retrieval success alone cannot refresh claims."
  },
  "reviewObservation": {
    "date": "2026-10-13",
    "method": "Rechecked relevant published claims; source-specific limits and conflicting terms remain explicit."
  }
}
