{
  "id": "official-dm-process",
  "publisher": "Dominica Citizenship by Investment Unit",
  "title": "Dominica: applying through an authorised agent",
  "url": "https://www.cbiu.gov.dm/news/dominica-citizenship/the-only-way-to-apply-for-dominica-citizenship-by-investment-is-through-an-authorised-agent/",
  "authorityType": "Official programme guidance",
  "documentDate": "2026-09-10",
  "rights": {
    "disposition": "link_only",
    "use": "Original CBI normalized facts and pointers only. No upstream documents, images, or excerpts distributed.",
    "basis": "CBI original compilation; upstream rights retained"
  },
  "retrieval": {
    "retrievedAt": "2026-10-25T08:26:36.066Z",
    "lastAttempt": "2026-10-25T08:26:36.066Z",
    "method": "retrieval_hash_only",
    "health": "available",
    "hash": "169b36d0c422bb1f893a4964ff8172a0e9dacb16695f67e9c66d9ee9fa18efd2"
  },
  "manualReview": {
    "intervalDays": 14,
    "rationale": "Evidence interpretation requires editorial review; a successful fetch is not verification."
  },
  "reviewObservation": {
    "date": "2026-10-21",
    "method": "Full official guidance read. A processing guide is not measured delivery performance or a passport guarantee."
  }
}
