{
  "id": "publication-entry-nationality",
  "publisher": "Immigration, Refugees and Citizenship Canada",
  "title": "Entry requirements by nationality, status and travel document",
  "url": "https://www.canada.ca/en/immigration-refugees-citizenship/services/visit-canada/entry-requirements-country.html",
  "authorityType": "Government guidance",
  "documentDate": null,
  "rights": {
    "disposition": "link_only",
    "use": "CBI original factual normalization and references only; no upstream pages, PDFs, images or excerpts redistributed",
    "basis": "Original compilation; no upstream republication licence asserted"
  },
  "retrieval": {
    "retrievedAt": "2026-10-25T08:26:36.066Z",
    "lastAttempt": "2026-10-25T08:26:36.066Z",
    "method": "retrieval_hash_only",
    "health": "available",
    "hash": "f9a20342e97c1277c62df42c2790055dccfae2222e56836dbf2c9b169698a9c1"
  },
  "manualReview": {
    "intervalDays": 14,
    "rationale": "Review exact claim and source applicability; retrieval success alone cannot refresh claims."
  },
  "reviewObservation": {
    "date": "2026-10-24",
    "method": "Dated claim review recorded in CBI source register"
  }
}
