{
  "id": "vu",
  "publisher": "Vanuatu Citizenship Commission",
  "title": "Official citizenship office",
  "url": "https://vancitizenship.gov.vu/",
  "authorityType": "Government guidance",
  "documentDate": null,
  "rights": {
    "disposition": "link_only",
    "use": "CBI original factual normalization and references only; no upstream pages, PDFs, images or excerpts redistributed",
    "basis": "Original compilation; no upstream republication licence asserted"
  },
  "retrieval": {
    "retrievedAt": "2026-10-25T08:26:36.066Z",
    "lastAttempt": "2026-10-25T08:26:36.066Z",
    "method": "retrieval_hash_only",
    "health": "available",
    "hash": "530d11e67f3f4f129616949e739513ce19a507ed7c0e063e76f1c6d2095e738b"
  },
  "manualReview": {
    "intervalDays": 14,
    "rationale": "Review exact claim and source applicability; retrieval success alone cannot refresh claims."
  },
  "reviewObservation": {
    "date": "2026-10-12",
    "method": "Full page retrieved"
  }
}
