{
  "id": "ch-nauru-visa",
  "publisher": "Swiss State Secretariat for Migration",
  "title": "Nauru ordinary passport requires short-stay visa",
  "url": "https://www.sem.admin.ch/sem/en/home/publiservice/weisungen-kreisschreiben/visa/liste1_staatsangehoerigkeit/n.html",
  "authorityType": "Government guidance",
  "documentDate": null,
  "rights": {
    "disposition": "link_only",
    "use": "CBI original factual normalization and references only; no upstream pages, PDFs, images or excerpts redistributed",
    "basis": "Original compilation; no upstream republication licence asserted"
  },
  "retrieval": {
    "retrievedAt": "2026-10-25T08:26:36.066Z",
    "lastAttempt": "2026-10-25T08:26:36.066Z",
    "method": "retrieval_hash_only",
    "health": "available",
    "hash": "4a441027f4685b4c1f7b3deddf3c0b73290f8d9dae1e10329a9eae8571f03564"
  },
  "manualReview": {
    "intervalDays": 14,
    "rationale": "Review exact claim and source applicability; retrieval success alone cannot refresh claims."
  },
  "reviewObservation": {
    "date": "2026-10-13",
    "method": "Primary source reviewed; conditions retained"
  }
}
