{
  "id": "comparison-vu-dsp-tariff25",
  "publisher": "Vanuatu Citizenship Office and Commission",
  "title": "Current published DSP selling-price and diligence table",
  "url": "https://vancitizenship.gov.vu/index.php/citizenship/fees-and-charges",
  "authorityType": "Government guidance",
  "documentDate": null,
  "rights": {
    "disposition": "link_only",
    "use": "Original CBI normalized facts and pointers only. No upstream documents, images, or excerpts distributed.",
    "basis": "CBI original compilation; upstream rights retained"
  },
  "retrieval": {
    "retrievedAt": "2026-10-25T08:26:36.066Z",
    "lastAttempt": "2026-10-25T08:26:36.066Z",
    "method": "retrieval_hash_only",
    "health": "available",
    "hash": "ceab568221fa824e0545e2711d578e740aac1805fba84443f430935e898ad876"
  },
  "manualReview": {
    "intervalDays": 14,
    "rationale": "Evidence interpretation requires editorial review; a successful fetch is not verification."
  },
  "reviewObservation": {
    "date": "2026-10-25",
    "method": "Dated claim review"
  }
}
