{
  "id": "lc-renewal-taipei",
  "publisher": "Embassy of Saint Lucia in Taiwan",
  "title": "Passport renewal: CBI applicants through Taipei",
  "url": "https://www.sluembassy.tw/consular-services",
  "authorityType": "Government consular guidance",
  "documentDate": null,
  "rights": {
    "disposition": "link_only",
    "use": "CBI original factual normalization and source pointers only; no upstream documents or excerpts redistributed",
    "basis": "Original CBI compilation; upstream rights retained"
  },
  "reviewObservation": {
    "date": "2026-10-25",
    "method": "Independent primary-source CBI review; legal document locators and limitations recorded"
  },
  "retrieval": {
    "retrievedAt": "2026-10-25T09:14:10.344Z",
    "lastAttempt": "2026-10-25T09:14:10.344Z",
    "method": "retrieval_hash_only",
    "health": "available",
    "hash": "c00a717f87ef2877bd01795df1b77108c4286914d4aeb03ba53be0d79e88397d"
  },
  "manualReview": {
    "intervalDays": 14,
    "rationale": "Review exact legal/operational scope; retrieval cannot refresh the factual review."
  }
}
