{
  "id": "eu-visa-list",
  "publisher": "European Union EUR-Lex",
  "title": "Consolidated Regulation 2018/1806, 30 December 2025",
  "url": "https://eur-lex.europa.eu/eli/reg/2018/1806/2025-12-30/eng",
  "authorityType": "Government guidance",
  "documentDate": null,
  "rights": {
    "disposition": "link_only",
    "use": "CBI original factual normalization and references only; no upstream pages, PDFs, images or excerpts redistributed",
    "basis": "Original compilation; no upstream republication licence asserted"
  },
  "retrieval": {
    "retrievedAt": null,
    "lastAttempt": "2026-10-25T08:26:36.066Z",
    "method": "not_extracted",
    "health": "unavailable",
    "hash": null
  },
  "manualReview": {
    "intervalDays": 14,
    "rationale": "Review exact claim and source applicability; retrieval success alone cannot refresh claims."
  },
  "reviewObservation": {
    "date": "2026-10-13",
    "method": "Primary source reviewed; conditions retained"
  }
}
