{
  "id": "sv",
  "publisher": "Government of El Salvador",
  "title": "Freedom Passport programme",
  "url": "https://world.adoptingelsalvador.gob.sv/welcome",
  "authorityType": "Government guidance",
  "documentDate": null,
  "rights": {
    "disposition": "link_only",
    "use": "CBI original factual normalization and references only; no upstream pages, PDFs, images or excerpts redistributed",
    "basis": "Original compilation; no upstream republication licence asserted"
  },
  "retrieval": {
    "retrievedAt": "2026-10-25T08:26:36.066Z",
    "lastAttempt": "2026-10-25T08:26:36.066Z",
    "method": "retrieval_hash_only",
    "health": "available",
    "hash": "c22bdddc360ea9de2ca7588add3b992e291ce409ae3d77aad0fb53d350afbe80"
  },
  "manualReview": {
    "intervalDays": 14,
    "rationale": "Review exact claim and source applicability; retrieval success alone cannot refresh claims."
  },
  "reviewObservation": {
    "date": "2026-10-13",
    "method": "Rechecked relevant published claims; source-specific limits and conflicting terms remain explicit."
  }
}
