{
  "id": "lc-old",
  "publisher": "Saint Lucia CIP",
  "title": "Frequently asked questions",
  "url": "https://www.cipsaintlucia.com/faqs",
  "authorityType": "Government guidance",
  "documentDate": null,
  "rights": {
    "disposition": "link_only",
    "use": "CBI original factual normalization and references only; no upstream pages, PDFs, images or excerpts redistributed",
    "basis": "Original compilation; no upstream republication licence asserted"
  },
  "retrieval": {
    "retrievedAt": "2026-10-25T08:26:36.066Z",
    "lastAttempt": "2026-10-25T08:26:36.066Z",
    "method": "retrieval_hash_only",
    "health": "available",
    "hash": "858e6494a5f0b6e076923e4850cdc49646ce81cd40ae60bf864f57c8b9896935"
  },
  "manualReview": {
    "intervalDays": 14,
    "rationale": "Review exact claim and source applicability; retrieval success alone cannot refresh claims."
  },
  "reviewObservation": {
    "date": "2026-10-12",
    "method": "Official indexed text reviewed"
  }
}
