{
  "id": "update-lc-report",
  "publisher": "Saint Lucia Citizenship by Investment Unit",
  "title": "CIP annual report 2024/25, page 19",
  "url": "https://www.cipsaintlucia.com/s/CIP-AR-2024_web.pdf",
  "authorityType": "Official publication",
  "documentDate": null,
  "rights": {
    "disposition": "link_only",
    "use": "Original CBI normalized facts and pointers only. No upstream documents, images, or excerpts distributed.",
    "basis": "CBI original compilation; upstream rights retained"
  },
  "retrieval": {
    "retrievedAt": null,
    "lastAttempt": "2026-10-25T08:37:07.920Z",
    "method": "not_extracted",
    "health": "unavailable",
    "hash": null
  },
  "manualReview": {
    "intervalDays": 14,
    "rationale": "Evidence interpretation requires editorial review; a successful fetch is not verification."
  },
  "reviewObservation": {
    "date": "2026-10-22",
    "method": "Downloaded from the official statistics page; page 19 extracted and visually checked. These are application counts, not people, matched cohorts or personal approval probabilities."
  }
}
