{
  "id": "comparison-vu-distinct-formd25",
  "publisher": "Vanuatu Citizenship Office and Commission",
  "title": "Separate citizenship routes and Form D classification",
  "url": "https://vancitizenship.gov.vu/index.php/citizenship/forms",
  "authorityType": "Government guidance",
  "documentDate": null,
  "rights": {
    "disposition": "link_only",
    "use": "Original CBI normalized facts and pointers only. No upstream documents, images, or excerpts distributed.",
    "basis": "CBI original compilation; upstream rights retained"
  },
  "retrieval": {
    "retrievedAt": "2026-10-25T08:37:07.920Z",
    "lastAttempt": "2026-10-25T08:37:07.920Z",
    "method": "retrieval_hash_only",
    "health": "available",
    "hash": "16a5301dfc18b1d832a954c496a5d7639bfe53cb14d5e685e7edab91fce9d86d"
  },
  "manualReview": {
    "intervalDays": 14,
    "rationale": "Evidence interpretation requires editorial review; a successful fetch is not verification."
  },
  "reviewObservation": {
    "date": "2026-10-25",
    "method": "Dated claim review"
  }
}
