{
  "id": "official-dm-agents",
  "publisher": "Dominica Citizenship by Investment Unit",
  "title": "Dominica authorised agents register",
  "url": "https://www.cbiu.gov.dm/dominica-citizenship/authorised-agents/",
  "authorityType": "Official agent register",
  "documentDate": null,
  "rights": {
    "disposition": "link_only",
    "use": "Original CBI normalized facts and pointers only. No upstream documents, images, or excerpts distributed.",
    "basis": "CBI original compilation; upstream rights retained"
  },
  "retrieval": {
    "retrievedAt": "2026-10-25T08:37:07.920Z",
    "lastAttempt": "2026-10-25T08:37:07.920Z",
    "method": "retrieval_hash_only",
    "health": "available",
    "hash": "9deaf8fcdd9da4ad81e886ca98f0c750b647dd0d2e456f3ec4d30a820df4acd8"
  },
  "manualReview": {
    "intervalDays": 14,
    "rationale": "Evidence interpretation requires editorial review; a successful fetch is not verification."
  },
  "reviewObservation": {
    "date": "2026-10-21",
    "method": "Register and explanatory text read. No named provider is endorsed or given a quality score."
  }
}
